id,word,reading,meaning,sentence,tags
226,思い,おもい,мысль; ожидания; желания,あの人に私の思いが届いた,Unit02
227,考え,かんがえ,"мысль, идея, мнение, намерение",,Unit02
228,片づけ,かたづけ,"наведение порядка, уборка, завершение чего-либо",,Unit02
229,手伝い,てつだい,помощь,,Unit02
230,働き,はたらき,"работа, труд, функционирование,способности",,Unit02
231,決まり,きまり,"""Решено!""",,Unit02
232,騒ぎ,さわぎ,"шум, шумиха",,Unit02
233,知らせ,しらせ,"извещение, уведомление, предвести",,Unit02
234,頼み,たのみ,"просьба, надежда, опора",,Unit02
235,疲れ,つかれ,"усталость, утомление",,Unit02
236,違い,ちがい,"отличие, разница, расхождение, ошибка",,Unit02
237,始め,はじめ,начало,,Unit02
238,続き,つづき,продолжение,,Unit02
239,暮れ,くれ,"конец дня, сумерки, конец года или сезона",,Unit02
240,行き,いき,ходьба; езда,,Unit02
241,帰り,かえり,возвращение,,Unit02
242,急ぎ,いそぎ,спешка,,Unit02
243,遅れ,おくれ,"запаздывание, неудача, провал, робость, неуверенность",,Unit02
244,貸し,かし,"сдача в наём, прокат, ссуда",,Unit02
245,借り,かり,"взятие в долг, задолженность",,Unit02
246,勝ち,かち,победа,,Unit02
247,負け,まけ,"поражение, проигрыш",,Unit02
248,迎え,むかえ,"встеча, встречающий",,Unit02
249,始まり,はじまり,начало,,Unit02
250,終わり,おわり,конец,,Unit02
251,戻り,もどり,возвращение,,Unit02
252,別れ,わかれ,"отделение, ответвление, развилка, разлука",,Unit02
253,喜び,よろこび,"радость, поздравление",,Unit02
254,楽しみ,たのしみ,"удовольствие, развлечение; предвкушение",,Unit02
255,笑い,わらい,смех,,Unit02
256,驚き,おどろき,"изумление, испуг",,Unit02
257,怒り,いかり,"гнев, ярость",,Unit02
258,悲しみ,かなしみ,печаль,,Unit02
259,幸せな,しあわせな,"счастливый, удачливый",幸せな人生,Unit03
260,得意な,とくいな,хорошо разбирающийся,彼女はギターが得意だ,Unit03
261,苦手な,にがてな,"противный, неприятный",彼女はギターが苦手だ,Unit03
262,熱心な,ねっしんな,"ревностный, пылкий, горячий",熱心な仕事ぶりが認められて、昇進した,Unit03
263,夢中な,むちゅうな,"не помнящий себя, как во сне, потерявший голову",子供の頃、SF漫画に夢中になった,Unit03
264,退屈な,たいくつな,скучный,他の観客は笑いながら見ていたが、私には退屈な映画だった,Unit03
265,健康な,けんこうな,"бодрый, приподнятый",心も体も健康な子供を育てたい,Unit03
266,苦しい,くるしい,"тяжелый, мучительный, трудный",息が苦しい,Unit03
267,平気な,へいきな,"невозмутимый, равнодушный",彼女はどんなに悪口を言われても、平気な顔をしている,Unit03
268,悔しい,くやしい,"досадный, прискорбный, достойный сожаления",何度練習しても、上手くできなくて、悔しい,Unit03
269,うらやましい,うらやましい,завистливый,才能の豊かな人が羨ましい,Unit03
270,かゆい,かゆい,зудящий,蚊に刺されて、首が痒い,Unit03
271,おとなしい,おとなしい,спокойный (о характере),彼は大人しい人だ,Unit03
272,我慢強い,がまんづよい,терпеливый,我慢強い性格,Unit03
273,正直な,しょうじきな,"честный, правдивый, искренний",彼は正直な人だから、嘘を吐くことができない,Unit03
274,けちな,けちな,"скупой, жадный; захудалый, убогий",あの人はとてもけちだ,Unit03
275,我儘な,わがままな,своевольный,我が儘な人,Unit03
276,積極的な,せっきょくてきな,"положительный, позитивный",積極的な人,Unit03
277,消極的な,しょうきょくてきな,"негативный, пассивный",消極的な人,Unit03
278,満足な,まんぞくな,"удовлетворительный,достаточный,законченный",アルバイトだけでは満足な収入は得られない,Unit03
279,不満な,ふまんな,"недовольный, неудовлитворительный",この仕事に不満な点はない,Unit03
280,不安な,ふあんな,"тревожный, неуверенный, непрочный",最近、体の調子が良くない、悪い病気ではないかと不安だ,Unit03
281,大変な,たいへんな,ужасный,子育て中のお母さんは大変だ,Unit03
282,無理な,むりな,"невозможный, насильственный, необоснованный",たった百万円で家を建てるなんて、無理な話だ,Unit03
283,不注意な,ふちゅういな,"невнимательный, неосторожный",不注意な人,Unit03
284,楽な,らくな,"приятный, легкий",もう少し楽な暮らしがしたい,Unit03
285,面倒な,めんどうな,"обременительный, хлопотливый, утомительный",ご入会には面倒な手続きは要りません,Unit03
286,失礼な,しつれいな,"невежливый, грубый",挨拶しても返事もしない、なんて失礼な人だろう,Unit03
287,当然な,とうぜんな,"естественный, надлежащий",お金を借りたら、返すのが当然だ,Unit03
288,意外な,いがいな,"неожиданный, непредвиденный",事故を調査するうちに意外な事実が分かった,Unit03
289,結構な,けっこうな,"прекрасный, превосходный, великолепный",お味はいかがですか、大変結構です,Unit03
290,派手な,はでな,"яркий, броский, кричащий",派手な人,Unit03
291,地味な,じみな,"простой, скромный, умеренный",地味な人,Unit03
292,おしゃれな,おしゃれな,модный,彼女はとてもお洒落だ,Unit03
293,変な,へんな,странный,変なメールが届いたので、すぐに消した,Unit03
294,不思議な,ふしぎな,"чудесный, удивительный, загадочный",この村には不思議な話が伝わっている,Unit03
295,ましな,ましな,"лучший, более предпочтительный",咳が酷かったが、うがいをしたら、前より増しになった,Unit03
296,むだな,むだな,"пустой, напрасный",落ちると分かっているのに試験を受けるのは無駄なことだ,Unit03
297,自由な,じゆうな,свободный,赤ちゃんがいるので、自由な時間が殆どない,Unit03
298,不自由な,ふじゆうな,"неудобный, стеснительный",目が不自由な人,Unit03
299,暖まる／温まる,あたたまる,греться,,Unit03
300,暖める／温める,あたためる,"греть, подогревать",,Unit03
301,高まる,たかまる,повышаться,,Unit03
302,高める,たかめる,повышать,,Unit03
303,強まる,つよまる,"усиливаться, укрепляться",,Unit03
304,強める,つよめる,"усиливать, укреплять",,Unit03
305,弱まる,よわまる,"слабеть, ослабевать",,Unit03
306,弱める,よわめる,ослаблять,,Unit03
307,広まる,ひろまる,распространяться,,Unit03
308,広める,ひろめる,"расширять, распространять, оповещать;",,Unit03
309,深まる,ふかまる,углубляться,,Unit03
310,深める,ふかめる,углублять,,Unit03
311,世話,せわ,"услуга, помощь; забота, хлопоты",家ではペットの世話は私の仕事だ,Unit04
312,家庭,かてい,"семья, дом, домашний очаг",田中課長は仕事では厳しいが、家庭では優しいお父さんだそうだ,Unit04
313,協力,きょうりょく,"сотрудничество, взаимодействие",家族で協力して祖母の介護をした,Unit04
314,感謝,かんしゃ,"благодарность, признательность",アドバイスしてくれた先輩にとても感謝している,Unit04
315,（お）礼,れい,"поклон; приветствие, вежливость, учтивость; этикет;",お世話になった方にお礼をした,Unit04
316,（お）詫び,わび,извинение,迷惑をかけた人にお詫びをした,Unit04
317,お辞儀,おじぎ,поклон,お客様には丁寧にお辞儀をしましょう,Unit04
318,握手,あくしゅ,рукопожатие,コンサートで歌手と握手した,Unit04
319,いじわる,いじわる,"злой (упрямый, жестокий) человек;;~をする быть злым (упрямым, жестоким); дразнить [ся] , высмеивать кого-л.",好きな子にはつい意地悪してしまう,Unit04
320,いたずら,いたずら,"шалость, озорство, забава, развлечение",悪戯をして先生に怒られた,Unit04
321,節約,せつやく,экономия,生活費の節約,Unit04
322,経営,けいえい,"управление (предприятием, хозяйством, бизнесом), менеджмент",父はスーパーを経営している,Unit04
323,反省,はんせい,"самонаблюдение, самоанализ, обдумывание (сделанного, сказанного)",一日の反省を日記に書く,Unit04
324,実行,じっこう,"исполнение, реализация, осуществление [на практике]",この計画は実行が難しい,Unit04
325,進歩,しんぽ,прогресс,英語を勉強しているが、進歩がない,Unit04
326,変化,へんか,"перемена, изменение; трансформация, метаморфоза;",大きな変化,Unit04
327,発達,はったつ,"развитие, рост, прогресс",体や心が発達する,Unit04
328,体力,たいりょく,физическая сила,若者の体力が低下している,Unit04
329,出場,しゅつじょう,"выход (на сцену и т. п. ); выступление, участие",オリンピックへの出場が決まった,Unit04
330,活躍,かつやく,"[оживлённая] деятельность, активность",田中選手の活躍を期待する,Unit04
331,競争,きょうそう,"соревнование, состязания; соперничество, конкуренция",どちらがいい成績を取るか、友達と競争した,Unit04
332,応援,おうえん,"поддержка, помощь",自分の学校のチームを応援する,Unit04
333,拍手,はくしゅ,"аплодисменты, рукоплескания",ステージの歌手に拍手をする,Unit04
334,人気,にんき,"популярность, успех ;",彼はクラスで一番人気がある,Unit04
335,うわさ,うわさ,"слухи, толки, молва",クラスメートの噂をしていたら、そこに本人が現れた,Unit04
336,情報,じょうほう,информация ;,テレビから色々な情報を得る,Unit04
337,交換,こうかん,"обмен; размен, замена; замещение",プレゼントを交換する,Unit04
338,流行,りゅうこう,"мода, эпидемия;",新しい流行,Unit04
339,宣伝,せんでん,пропаганда; реклама,バーゲンセールの宣伝が始まった,Unit04
340,広告,こうこく,объявление; реклама; афиша,新聞に新製品の広告が載っていた,Unit04
341,注目,ちゅうもく,внимание; наблюдение,有名歌手の結婚が注目を集めている,Unit04
342,通訳,つうやく,[устный] перевод; переводчик,英語を日本語に通訳する,Unit04
343,翻訳,ほんやく,[письменный] перевод ;,日本語の小説を英語に翻訳する,Unit04
344,伝言,でんごん, [устное] сообщение,留守番電話に伝言を残す,Unit04
345,報告,ほうこく,"доклад, отчёт, сообщение, донесение, рапорт",出張の報告,Unit04
346,録画,ろくが,видеозапись; видеолента,テレビ番組をビデオに録画する,Unit04
347,混雑,こんざつ,"сутолока, суматоха, суета",デパートは大勢の人で混雑している,Unit04
348,渋滞,じゅうたい,задержка; застой; транспортная пробка,道路が渋滞していて、会議に遅刻した,Unit04
349,衝突,しょうとつ,"столкновение (напр. автомобилей); конфликт, ссора",電車の衝突の場面を見た,Unit04
350,被害,ひがい,"ущерб, потери, убытки",台風の被害,Unit04
351,事故,じこ,"происшествие, авария; несчастный случай; [непреодолимые] обстоятельства",事故の原因を調べる,Unit04
352,事件,じけん,"происшествие, событие, случай, инцидент; юр. дело",近所で子供が次々とい無くなるという事件があった,Unit04
353,故障,こしょう,"препятствие, помеха; авария",洗濯機が故障したので、コインランドリーへ行った,Unit04
354,修理,しゅうり,"ремонт, починка",パソコンが壊れたので、修理に出した,Unit04
355,停電,ていでん,отключение электричества (подачи электроэнергии),雷が落ちて停電した,Unit04
356,調子,ちょうし,"тон; интонация, муз. ритм; темп, манера ;",体の調子がいい,Unit04
357,緊張,きんちょう,"напряжение, напряжённость",面接では緊張して、上手く答えられなかった,Unit04
358,自信,じしん,уверенность [в себе];,体力に自信がある,Unit04
359,自慢,じまん,"самодовольство; хвастовство, гордость",自慢の料理を作る,Unit04
360,感心,かんしん,"восхищение, восторг",チンさんの進歩の速さに感心した,Unit04
361,感動,かんどう,"волнение, впечатление",パラリンピックを見て、とても感動した,Unit04
362,興奮,こうふん,возбуждение,試合を見ていた観客たちは、興奮して大声を出した,Unit04
363,感想,かんそう,впечатления,ご感想はいかがですか,Unit04
364,予想,よそう,"предположения, ожидания",選挙の結果を予想する,Unit04
365,専門,せんもん,специальность,専門は言語学です,Unit04
366,研究,けんきゅう,"исследования, научная работа",私は大学で日本の政治を研究している,Unit04
367,調査,ちょうさ,"исследование, обследование, изучение",調査を行う,Unit04
368,原因,げんいん,"причина; фактор; корень, источник",今警察が事故の原因を調べている,Unit04
369,結果,けっか,"результат, эффект, [по] следствие",一位になりたかったが、結果は三位だった,Unit04
370,解決,かいけつ,[раз] решение (вопроса и т. п.),大きな問題が解決した,Unit04
371,確認,かくにん,"подтверждение, признание",間違いがないかどうかを確認する,Unit04
372,利用,りよう,использование,水不足なので、水道の利用を減らした,Unit04
373,理解,りかい,понимание,意味の理解,Unit04
374,発見,はっけん,открытие,大きな発見,Unit04
375,発明,はつめい,изобретение;  одарённость,ベルは電話を発明した,Unit04
376,関係,かんけい,"отношение, касательство, связь, влияние",お二人の関係は、親子です,Unit04
377,団体,だんたい,"группа, коллектив; организация, объединение",博物館で団体のチケットを買う,Unit04
378,選挙,せんきょ,выборы,一月に選挙が行われる,Unit04
379,税金,ぜいきん,налог; пошлина; сбор,年度末に税金を払う,Unit04
380,責任,せきにん,ответственность,この失敗はあなたの責任ではない,Unit04
381,書類,しょるい,"документы, бумаги",留学の手続きに必要な書類を準備する,Unit04
382,題名,だいめい,"заглавие, название",コンクールに出す作品に題名を付ける,Unit04
383,条件,じょうけん,условие; условия,運転免許を持っていることが採用の条件だ,Unit04
384,締め切り,しめきり,"крайний срок, последний день (подачи заявок и т. п. );",レポートの締め切りは三十日です,Unit04
385,期間,きかん,"период, срок, отрезок времени",申し込み期間は十二月一日から三日までです,Unit04
386,倍,ばい,"удваивать; двойной, удвоенный",値段が倍になる,Unit04
387,くじ,くじ,жребий; лотерея,スーパーで買い物をして、くじを引いたら、テレビが当たった,Unit04
388,近道,ちかみち,кратчайший (прямой) путь,駅への近道を通る,Unit04
389,中心,ちゅうしん,"центр; середина; средоточие, равновесие",町の中心,Unit04
390,辺り,あたり,ближайшее окружение; окрестности,辺りを見回す,Unit04
391,周り,まわり,"окружность, круг, край, кромка, кайма",池の周りを歩く,Unit04
392,穴,あな,"отверстие, дыра; скважина; щель; трещина",地面に穴を掘る,Unit04
393,列,れつ,ряд; шеренга; колонна; вереница; очередь,入口の前には長い列ができていた,Unit04
394,幅,はば,"Ширина, влияние, вес (в идиомах)",道の幅が広い,Unit04
395,範囲,はんい,"сфера, область, круг; диапазон; пределы",試験の範囲,Unit04
396,内容,ないよう,"содержание, содержимое;",話の内容,Unit04
397,中身,なかみ,"содержимое, содержание; наполнитель;",箱を開けて中身を見る,Unit04
398,特徴,とくちょう,"отличительная (характерная) черта, особенность, своеобразие",商品の特徴を確かめる,Unit04
399,普通,ふつう,обычный; простой; нормальный,パスポートの申請には一週間ぐらいかかるのが普通だ,Unit04
400,当たり前,あたりまえ,"естественно, ничего удивительного, само собой разумеется",そんな酷いことをされたら、怒るのが当たり前だ,Unit04
401,偽,にせ,"подделка, фальшивка",偽の銀行員に騙されてお金を取られた,Unit04
402,別,べつ,"различие, разница, особо, отдельно, специально",米はご飯とは別の物だ,Unit04
403,国籍,こくせき,"гражданство, подданство",私はずっとアメリカで暮らしているが、国籍は日本だ,Unit04
404,東洋,とうよう,"Восток, страны Востока",東洋の文化と西洋の文化を比べる,Unit04
405,西洋,せいよう,"Запад, страны Запада",東洋の文化と西洋の文化を比べる,Unit04
406,国際,こくさい,"международный, интернациональный",日本企業の海外支社でのトラブルが国際問題に発展した,Unit04
407,自然,しぜん,природа,山や海へ行って、自然の中で過ごす,Unit04
408,景色,けしき,"вид, пейзаж",初めて日本の山に行った、素晴らしい景色だった,Unit04
409,宗教,しゅうきょう,религия,世界には色々な宗教がある,Unit04
410,愛,あい,любовь,私は家族を愛している,Unit04
411,届く,とどく,"доставать, достигать, доходить",父から手紙が届いた,Unit05
412,届ける,とどける,"доставлять, заявлять, докладывать",隣の家に旅行のお土産を届けた,Unit05
413,かく,かく,"чесать, сгребать, сидеть скрестив ноги, отрубать, потеть",頭を掻く,Unit05
414,つかむ,つかむ,"хватать, схватывать",電車で突然腕を掴まれて、びっくりした,Unit05
415,握る,にぎる,"брать (в руки), держать, захватывать, получать",子供は怖がって、母親の手を強く握った,Unit05
416,押さえる,おさえる,"надавить, прикрыть (руками)",あの人はお腹を押さえて、座っている、腹痛だろうか,Unit05
417,近づく,ちかづく,"приближаться, подходить",目的地が近づいてきた,Unit05
418,近づける,ちかづける,"придвигать, приближать, подпускать",車を道の脇に近づける,Unit05
419,合う,あう,"подходить (для чего-либо), совпадать, быть правильным",不図顔を上げると、先生と目が合ってしまった,Unit05
420,合わせる,あわせる,"(при)соединять, согласовывать, сличать, сопоставлять",皆で力を合わせて頑張りましょう,Unit05
421,当たる,あたる,"попадать (в цель), оказываться правильным, иметь успех, быть уместным",ボールが当たって、窓ガラスが割れた,Unit05
422,当てる,あてる,"накладывать, попадать (в цель), угадать, предназначать",相手選手のボールが早いので、ラケットに当てるのも大変だ,Unit05
423,比べる,くらべる,сравнивать,東京と大阪の面積を比べる,Unit05
424,似合う,にあう,быть подходящим,彼女は着物が良く似合う,Unit05
425,似る,にる,"быть похожим, походить",彼女は母親に良く似ている,Unit05
426,似せる,にせる,"копировать, подделывать",アイドルに髪型を似せる,Unit05
427,分かれる,わかれる,"разделять, отделять, расставаться",トイレは男性用と女性用に分かれている,Unit05
428,分ける,わける,"делить. Разъединять, сортировать",財産を三人の子供に分ける,Unit05
429,足す,たす,"добавлять, прибавлять",味が薄かったので、塩を足した,Unit05
430,引く,ひく,"тянуть, тащить, привлекать (внимание), проводить (линию)",このドアは押すのではなく、引いて開けるんです,Unit05
431,増える,ふえる,"увеличиваться, ;прибавляться",貯金が増える,Unit05
432,増やす,ふやす,"увеличивать, приумноать",貯金を増やす,Unit05
433,減る,へる,"уменьшаться, сокращаться, стираться",貯金が減る,Unit05
434,減らす,へらす,"уменьшать, сокращать, снижать",貯金を減らす,Unit05
435,変わる,かわる,"изменяться, отличаться<br><br>",季節が変わる,Unit05
436,変える,かえる,"менять, изменять",髪型を変える,Unit05
437,代わる／替わる／換わる,かわる,"заменять, замещать, приходить на смену",四月に店長が変わった,Unit05
438,代える／替える／換える,かえる,"менять (одно на другое), заменять",千円札を百円玉に変えてもらった,Unit05
439,返る,かえる,"возвращаться (к чему-либо), быть отданным обратно",友達に貸したお金が返ってきた,Unit05
440,返す,かえす,"возвращать, отдавать обратно",この本は二週間以内に図書館に返さなければならない,Unit05
441,譲る,ゆずる,"отдавать, передавать, уступать (права, место, дорогу)",電車の中で、お年寄りに席を譲った,Unit05
442,助かる,たすかる,спасаться,飛行機が落ちたが、三人が助かった,Unit05
443,助ける,たすける,спасать,川に落ちた子供を助けた,Unit05
444,いじめる,いじめる,"мучить, издеваться",弟を苛める,Unit05
445,だます,だます,"обманывать. Околдовывать, успокаивать",彼は独身だと騙して、五人の女性と付き合っていた,Unit05
446,盗む,ぬすむ,"красть, воровать",留守中に泥棒に入られて、お金を盗まれてしまった,Unit05
