id,word,reading,meaning,sentence,tags
1,男性,だんせい,"мужчина, мужской пол, мужественность",理想の男性と結婚する,Unit01
2,女性,じょせい,"женщина, женский пол, женственность",あの女性は誰ですか,Unit01
3,高齢,こうれい,преклонный возраст,祖母は高齢だが、まだとても元気だ,Unit01
4,年上,としうえ,старший по возрасту,年上の友達,Unit01
5,目上,めうえ,"начальство, старшие",目上の人には敬語で話したほうがいい,Unit01
6,先輩,せんぱい,"старший товарищ, старший по курсу",田中さんと私は同じ年だが、職場では彼のほうが先輩だ,Unit01
7,後輩,こうはい,"младший товарищ, молодое поколение",田中さんと私は同じ年だが、職場では彼のほうが先輩だ,Unit01
8,上司,じょうし,"старший по чину, начальник",上司に相談してから、決定する,Unit01
9,相手,あいて,"партнёр, собеседник",相手の目を見て話す,Unit01
10,知り合い,しりあい,знакомство,知り合いに息子の就職を頼む,Unit01
11,友人,ゆうじん,"друг, приятель",学生時代の友人です,Unit01
12,仲,なか,отношения с кем-либо,私は山本さんと仲がいい,Unit01
13,生年月日,せいねんがっぴ,дата рождения,書類に生年月日を記入する,Unit01
14,誕生,たんじょう,рождение,新しい命の誕生を祝う,Unit01
15,年,とし,год,年の始に一年の計画を立てる,Unit01
16,出身,しゅっしん,"родом из, выпускник",ご出身はどちらですか,Unit01
17,故郷,こきょう,"родные места, родная деревня",仕事は忙しくて、もう何年も故郷に帰っていない,Unit01
18,成長,せいちょう,рост,子供の成長を喜ぶ,Unit01
19,成人,せいじん,совершеннолетний,日本では二十歳以上の人を成人という,Unit01
20,合格,ごうかく,соответствовать требованиям,大学に合格する,Unit01
21,進学,しんがく,поступление в учебное заведение более высокой ступени,子供の進学について考える,Unit01
22,退学,たいがく,выход из учебного заведения,退学の理由を説明する,Unit01
23,就職,しゅうしょく,поступление на работу; поиск работы,旅行会社に就職する,Unit01
24,退職,たいしょく,выход на пенсию,母の介護のため、退職を決めた,Unit01
25,失業,しつぎょう,безработица,会社が倒産して失業した,Unit01
26,残業,ざんぎょう,"сверхурочная работа, переработка",残業が多くて疲れた,Unit01
27,生活,せいかつ,образ жизни,健康的な生活を送る,Unit01
28,通勤,つうきん,поездки на работу,私は毎日一時間かけて通勤している,Unit01
29,学歴,がくれき,"история образования, полученное образование",学歴が高くても、実力があるかどうかは分からない,Unit01
30,給料,きゅうりょう,зарплата,会社から給料を貰う,Unit01
31,面接,めんせつ,собеседование,今日会社の人との面接がある,Unit01
32,休憩,きゅうけい,"отдых, перемена, перерыв",ではここで、十分間の休憩です,Unit01
33,観光,かんこう,туризм,来日の目的は観光です,Unit01
34,帰国,きこく,возвращение на родину,今度の正月には帰国するつもりだ,Unit01
35,帰省,きせい,"посещение родины, поездка в родные места",お盆には故郷に帰省する日本人が多い,Unit01
36,帰宅,きたく,возвращение домой (с работы и т.п.),毎日忙しくて帰宅が遅い,Unit01
37,参加,さんか,"участвовать, принимать участие",ボランティア活動に参加する,Unit01
38,出席,しゅっせき,присутствовать,ミーティングに出席する,Unit01
39,欠席,けっせき,отсутствовать,授業を欠席する,Unit01
40,遅刻,ちこく,опоздание,寝坊して授業に遅刻する,Unit01
41,化粧,けしょう,косметика,あなたは毎日、お化粧に何分ぐらいかけていますか,Unit01
42,計算,けいさん,вычисление,私は計算が苦手だ,Unit01
43,計画,けいかく,планы,来年の計画を立てる,Unit01
44,成功,せいこう,успех,実験に成功する,Unit01
45,失敗,しっぱい,"провал, ошибка",実験の失敗で、計画は中止になった,Unit01
46,準備,じゅんび,подготовка,引っ越しの準備が終わった,Unit01
47,整理,せいり,"организация, приборка",資料の整理,Unit01
48,注文,ちゅうもん,заказ,注文の品が届く,Unit01
49,貯金,ちょきん,банковский вклад,貯金が増える,Unit01
50,徹夜,てつや,бессонная ночь,徹夜が続く,Unit01
51,引っ越し,ひっこし,переезд,引っ越しを手伝う,Unit01
52,身長,しんちょう,рост человека,身長を測る,Unit01
53,体重,たいじゅう,вес,体重を測る,Unit01
54,けが,けが,рана,小さな怪我,Unit01
55,会,かい,вечеринка,忘年会を開く,Unit01
56,趣味,しゅみ,хобби,趣味は読書です,Unit01
57,興味,きょうみ,интерес к чему-либо,私は歴史に興味がある,Unit01
58,思い出,おもいで,воспоминания,子供の頃の思い出,Unit01
59,冗談,じょうだん,шутка,冗談を言ったら皆が本気にした,Unit01
60,目的,もくてき,"цель, задача",日本に来た目的は大学への入学だ,Unit01
61,約束,やくそく,обещание,彼と結婚の約束をした,Unit01
62,おしゃべり,おしゃべり,"разговор, болтовня",授業中に隣の人とお喋りしていて、先生に怒られた,Unit01
63,遠慮,えんりょ,"стыд, стеснение",遠慮しないで、食べてください,Unit01
64,我慢,がまん,терпение,痛くても我慢する,Unit01
65,迷惑,めいわく,"беспокойство, стеснение, тягость",人に迷惑をかけてはいけない,Unit01
66,希望,きぼう,"надежды, пожелания",最後まで希望を捨ててはいけない,Unit01
67,夢,ゆめ,"сон, мечта",昨日怖い夢を見た,Unit01
68,賛成,さんせい,"""Согласен!""",賛成の人は手を挙げてください,Unit01
69,反対,はんたい,быть против,プラスの反対はマイナスだ,Unit01
70,想像,そうぞう,воображение,想像と現実は違う,Unit01
71,努力,どりょく,"старания, усилия",一生懸命努力をする,Unit01
72,太陽,たいよう,солнце,太陽が昇って、暖かくなった,Unit01
73,地球,ちきゅう,Земля,地球の環境が悪化している,Unit01
74,温度,おんど,температура воздуха,温度を測る,Unit01
75,湿度,しつど,"влажность, уровень влажности",今年の夏は特に湿度が高い,Unit01
76,湿気,しっけ,"влажность, сырость",日本の夏は湿気が多い,Unit01
77,梅雨,つゆ,сезон дождей,六月から七月は梅雨の時期だ,Unit01
78,かび,かび,плесень,梅雨の時期はかびが生えやすい,Unit01
79,暖房,だんぼう,отпление,寒いので暖房をつける,Unit01
80,皮,かわ,кожура,果物の皮,Unit01
81,缶,かん,"банка, жестянка",お菓子をカンに入れて保存する,Unit01
82,画面,がめん,экран,パソコンの画面をずっと見ていると、目が疲れる,Unit01
83,番組,ばんぐみ,передача,テレビの番組を見る,Unit01
84,記事,きじ,заметка,この記事によると、日本に住む外国人が増えているそうだ,Unit01
85,近所,きんじょ,"сосeдний, соседнее место",近所の人とは仲良くしたほうがいい,Unit01
86,警察,けいさつ,полиция,自転車を盗まれたので、警察に届けた,Unit01
87,犯人,はんにん,преступнк,事件の犯人,Unit01
88,小銭,こぜに,мелкие деньги,バスに乗ってから、小銭がないことに気が付き、とても困った,Unit01
89,ごちそう,ごちそう,угощения,家族皆でご馳走を食べて、祖父の誕生日を祝った,Unit01
90,作者,さくしゃ,"писатель, автор",小説の作者,Unit01
91,作品,さくひん,"произведение, авторская работа",学生の作品をロビーに展示する,Unit01
92,制服,せいふく,школьная форма,日本の中学校には制服のある学校が多い,Unit01
93,洗剤,せんざい,моющее средство,洗剤で食器を洗う,Unit01
94,底,そこ,дно,靴の底に穴が空く,Unit01
95,地下,ちか,подвал,大都市は地下の開発が進んでいる,Unit01
96,寺,てら,храм,寺に参る,Unit01
97,道路,どうろ,дорога,道路が込む,Unit01
98,坂,さか,склон,坂を上る,Unit01
99,煙,けむり,дым,火事のときは煙に注意して逃げてください,Unit01
100,灰,はい,пепел,煙草の灰,Unit01
101,判,はん,личная печать,書類に判を押す,Unit01
102,名刺,めいし,визитка,名刺を交換する,Unit01
103,免許,めんきょ,лицензия,レストランを開くには調理師の免許が必要だ,Unit01
104,多く,おおく,много,オリンピックには多くの国が参加した,Unit01
105,前半,ぜんはん,первая половина,映画の前半は退屈だったが、後半は面白かった,Unit01
106,後半,こうはん,вторая половина,映画の前半は退屈だったが、後半は面白かった,Unit01
107,最高,さいこう,"самый лучший, самый высокий",最高気温,Unit01
108,最低,さいてい,самый низкий,最低気温,Unit01
109,最初,さいしょ,вначале,最初にひらがなを、次にカタカナを勉強した,Unit01
110,最後,さいご,самый последний,あとから来た人は列の最後に並んでください,Unit01
111,自動,じどう,самодвижущийся,このドアは自動だから、手で開けなくてもいい,Unit01
112,種類,しゅるい,"тип, сорт",公園には色々な種類の花がある,Unit01
113,性格,せいかく,характер,あの人は性格がいいので、みんなに好かれている,Unit01
114,性質,せいしつ,"характеристика, характер, натура",この布は燃えにくい性質を持っている,Unit01
115,順番,じゅんばん,"очередь, очередность",発表の順番を決める,Unit01
116,番,ばん,"порядок, номер, очередь",次は私の番だ,Unit01
117,方法,ほうほう,способ,いい方法を探す,Unit01
118,製品,せいひん,"готовая продукция, товары",完成した製品を検査する,Unit01
119,値上がり,ねあがり,повышение цены,食品の値上がり,Unit01
120,生,なま,"свежий, в сыром виде",生の魚,Unit01
121,渇く,かわく,хотеть пить (один глагол),喉が渇いた,Unit02
122,嗅ぐ,かぐ,"нюхать, обонять, чуять",匂いを嗅ぐ,Unit02
123,叩く,たたく,"бить, полотить; критиковать",子供のお尻を叩く,Unit02
124,殴る,なぐる,"ударять, бить, колотить",教師が生徒を殴って、問題になっている,Unit02
125,ける,ける,"пинать, бить ногой",ボールを蹴る,Unit02
126,抱く,だく,"обнимать, держать на руках",子供を両手でしっかりと抱く,Unit02
127,倒れる,たおれる,"падать, рушиться, терпеть крах, погибнуть",台風で木が倒れた,Unit02
128,倒す,たおす,"валить, опрокидывать, свергать, убить",花瓶を倒して割ってしまった,Unit02
129,起きる／起こる,おきる／おこる,"вставать, просыпаться; случаться, происходить",今日は八時に起きた<br>昨日教室でちょっとした事件が起こった,Unit02
130,起こす,おこす,"поднимать на ноги, будить, основывать",うちの子は朝起こしても、中々起きない,Unit02
131,尋ねる,たずねる,"спрашивать, разыскивать",交番で景観に市役所までの道を尋ねた,Unit02
132,呼ぶ,よぶ,"звать, вызывать, называть",名前を呼ばれたら、返事をしてください,Unit02
133,叫ぶ,さけぶ,кричать,大声で叫んだが、相手は気づかずに行ってしまった,Unit02
134,黙る,だまる,"молчать, промолчать",先生が質問したが、誰も答えないで黙っている,Unit02
135,飼う,かう,"кормить, выкармливать, содержать (животных)",何かペットを飼いたいと思っている,Unit02
136,数える,かぞえる,"считать, подсчитывать",数を数える,Unit02
137,乾く,かわく,"сохнуть, высыхать",風が強かったので、外に干した洗濯物はすぐに乾いた,Unit02
138,乾かす,かわかす,"сушить, просушивать",ドライヤーで濡れた髪を乾かした,Unit02
139,畳む,たたむ,"складывать (одеяло), закрывать, запирать",洗濯物を畳む,Unit02
140,誘う,さそう,"приглашать, звать",友達を誘って映画を見に行った,Unit02
141,おごる,おごる,"шиковать, платить за кого-то, угощать",昨日は後輩に焼き肉を奢った,Unit02
142,預かる,あずかる,"барть на время, принимать на хранение",旅行に行く友達から犬を預かることになった,Unit02
143,預ける,あずける,"давать на время, сдавать на хранение",銀行にお金を預けると、利子がつく,Unit02
144,決まる,きまる,"решаться, быть решенным",帰国の日が決まった,Unit02
145,決める,きめる,"решать, устанавливать, определять",進学か就職か、早く決めたほうがいいですよ,Unit02
146,写る,うつる,выходить (о снимке),このカメラは暗い所でも良く写る,Unit02
147,写す,うつす,"снимать копию, переписывать, фотографировать, изображать",写真を写す,Unit02
148,思い出す,おもいだす,вспоминать,毎年春になると、高校の入学式を思い出します,Unit02
149,教わる,おそわる,"учиться, обучаться",この料理の作り方は母から教わりました,Unit02
150,申し込む,もうしこむ,"подавать заявку, предлагать, заказывать, бронировать",パーティーに参加を申し込む,Unit02
151,断る,ことわる,"отклонять, отказывать, извиняться, просить разрешения",頼まれた仕事を断った,Unit02
152,見つかる,みつかる,быть обнаруженным,無くなったと思っていた指輪がソファーの下で見つかった,Unit02
153,見つける,みつける,"находить, обнаружить",無くなったと思っていた指輪をソファーの下で見つけた,Unit02
154,捕まる,つかまる,"быть схваченным, быть пойманным",犯人が警察に捕まった,Unit02
155,捕まえる,つかまえる,"схватить, поймать, арестовать",警察が泥棒を捕まえた,Unit02
156,乗る,のる,"садиться на транспортное средство, ехать на транспортном средстве",毎朝電車に乗って、学校に通っている,Unit02
157,乗せる,のせる,"сажать пассажиров, подвозить",子供を車に乗せて、学校まで送って行った,Unit02
158,降りる／下りる,おりる,"спускаться, сходить (вниз); сходить (с транспортного средства), выпадать (об осадках)",電車を降りる,Unit02
159,降ろす／下ろす,おろす,"опускать, снимать, сгружать; давать сойти, помочь выйти; опустить, спустить",あの銀行の前で降ろしてください,Unit02
160,直る,なおる,"быть исправленным, выздоравливать",壊れたパソコンが直った,Unit02
161,直す,なおす,"исправлять, чинить, приводить в порядок; излечивать",壊れた時計を直す,Unit02
162,治る,なおる,выздоравливать,中々頭痛が治らない,Unit02
163,治す,なおす,"лечить, излечивать",良く休んで、早く風邪を治してください,Unit02
164,亡くなる,なくなる,"скончаться, умереть",社長が九十歳で亡くなった,Unit02
165,亡くす,なくす,терять (кого-то близкого),彼は子供のとき、父親を亡くした,Unit02
166,生まれる,うまれる,родиться,先月子供が生まれた,Unit02
167,産む／生む,うむ,"рождать, рожать",妻が先日元気な女の子を産んだ,Unit02
168,出会う,であう,"встретиться случайно, столкнуться, ходить на свидания; гармонировать",駅で偶然大学時代の友人に出会った,Unit02
169,訪ねる,たずねる,"заходить, навещать, посещать",友人の家を訪ねた,Unit02
170,付き合う,つきあう,поддерживать знакомство,隣の家の人と親しく付き合っている,Unit02
171,効く,きく,быть эффективным,この薬は頭痛に良く効く,Unit02
172,はやる,はやる,быть в моде; свирепствовать (о болезни),この冬は赤い色が流行っている,Unit02
173,経つ,たつ,(время) идет,日本へ来てから、十年が経った,Unit02
174,間に合う,まにあう,"успевать вовремя; годиться, подходить",電車が遅れたが、駅から走って、何とか授業に間に合った,Unit02
175,間に合わせる,まにあわせる,"справиться с чем-либо, успеть, приготовить к сроку",レポートを、頑張って締め切りに間に合わせた,Unit02
176,通う,かよう,"ходить туда и обратно, курсировать, ходить (в школу, на работу)",学校に通う,Unit02
177,込む,こむ,быть переполненным (людьми),電車が込む,Unit02
178,すれ違う,すれちがう,"пройти мимо друг друга, разминуться",この道は狭いので、自動車がすれ違うのは大変だ,Unit02
179,掛かる,かかる,"висеть, прислоняться, зацепляться, требовать(ся) и т.п.",このサラダには何も掛かっていないようだ,Unit02
180,掛ける,かける,"вешать на что-либо, прислонять, накладывать и т.п.",料理に醤油を掛けて食べる,Unit02
181,動く,うごく,"двигаться, работать (о механизме)",写真を撮るから、動かないでください,Unit02
182,動かす,うごかす,"двигать, приводить в движение",酷い怪我をして、体を動かすこともできない,Unit02
183,離れる,はなれる,"отделяться, отходить, покидать, расставаться",危ないから、ストーブから離れて遊びなさい,Unit02
184,離す,はなす,"отделять, разделять, отпускать от себя",テストのときは机を離して並べる,Unit02
185,ぶつかる,ぶつかる,"налетать на кого-либо, натыкаться",道で自転車にぶつかって、怪我をした,Unit02
186,ぶつける,ぶつける,"швырять чем-либо в кого-либо, ударять, стукать обо что-либо",運転していて、車を電柱にぶつけてしまった,Unit02
187,こぼれる,こぼれる,"проливаться, переливаться через край, расплескиваться",手が震えて、お茶が零れてしまった,Unit02
188,こぼす,こぼす,"проливать, рассыпать, жаловаться, ныть",コップを倒して、水を零してしまった,Unit02
189,ふく,ふく,"вытирать, стирать (пыль, грязь)",汗を拭く,Unit02
190,片付く,かたづく,"быть прибранным, быть в порядке, быть улаженным",大掃除をして、やっと部屋が片付いた,Unit02
191,片付ける,かたづける,"приводить в порядок, прибирать",机の上を片付ける,Unit02
192,包む,つつむ,"обертывать, заворачивать, окутывать, скрывать",プレゼントをきれいな紙で包む,Unit02
193,張る,はる,"растягивать, натягивать, покрывать, оклеивать",壁にポスターを張る,Unit02
194,無くなる,なくなる,"пропадать, кончаться, иссякать",部屋の鍵が無くなってしまった,Unit02
195,無くす,なくす,уничтожать,パスポートを無くして、困っている,Unit02
196,足りる,たりる,"хватать, быть достаточным",この収入では生活するのに全然足りない,Unit02
197,残る,のこる,оставаться,料理を作りすぎて、たくさん残ってしまった,Unit02
198,残す,のこす,оставлять,ご飯を残してしまった,Unit02
199,腐る,くさる,"портиться, протухать",腐った物を食べて、お腹を壊してしまった,Unit02
200,むける,むける,"ободраться, облупиться",海で日焼けをして、背中の皮が剥けた,Unit02
201,むく,むく,"сдирать, обдирать, чистить, шелушить",果物の皮を剥く,Unit02
202,滑る,すべる,"скользить, кататься (на коньках), поскользнуться, быть скользким",新しいスケート場はきれいで、楽しく滑ることができた,Unit02
203,積もる,つもる,"нагромождаться, скапливаться; приблизительно оценивать",昨日降った雪が積もっている,Unit02
204,積む,つむ,"нагромождать, накапливать, грузить, копить, накапливать",机の上に本がたくさん積んである,Unit02
205,空く,あく,"быть пустым (свободным), иметь цель, закончиться, подойти к концу",靴下に穴が空いてしまった,Unit02
206,空ける,あける,"опорожнять, освобождать",壁に穴を空ける,Unit02
207,下がる,さがる,"свешиваться, свисать, падать, понижаться",熱が下る,Unit02
208,下げる,さげる,"спускать, понижать, снижать; вывешивать",熱を下げる,Unit02
209,冷える,ひえる,"охлаждаться, остывать, мёрзнуть, зябнуть",寒い所に長くいたので、手足が冷えてしまった,Unit02
210,冷やす,ひやす,"остужать, замораживать",この果物は冷やして、食べたほうが美味しい,Unit02
211,冷める,さめる,"остывать, охладевать",この料理は冷めると、美味しくない,Unit02
212,冷ます,さます,"остудить, охладить",お風呂のお湯が熱くなりすぎた、少し冷ましてから、入ろう,Unit02
213,燃える,もえる,"гореть, пылать",火が燃える,Unit02
214,燃やす,もやす,"зажигать, воспламенять",火を燃やす,Unit02
215,沸く,わく,"кипеть, закипать, буршить",湯が沸く,Unit02
216,沸かす,わかす,кипятить; будоражить,湯を沸かす,Unit02
217,鳴る,なる,"звучать, раздаваться, греметь",雷が鳴っている,Unit02
218,鳴らす,ならす,"вызывать звук при помощи чего-либо; раззвонить, разнести",ブザーを鳴らす,Unit02
219,役立つ／役に立つ,やくだつ／やくにたつ,"годиться, быть пригодным",インタネットの情報は勉強や仕事の役に立つ,Unit02
220,役立てる／役に立てる,やくだてる／やくにたてる,"приспособить, приладить, пустить в дело",インタネットの情報を勉強や仕事の役に立てる,Unit02
221,飾り,かざり,"украшение, убранство, орнамент",,Unit02
222,遊び,あそび,"игра, развлечение",,Unit02
223,集まり,あつまり,"собрание, сходка; сбор",,Unit02
224,教え,おしえ,"обучение, преподавание, учение, доктрина",,Unit02
225,踊り,おどり,танец,,Unit02
