id,word,reading,meaning,sentence,tags
447,刺さる,ささる,"вонзиться, застрять",指に棘が刺さって、痛い,Unit05
448,刺す,さす,"вонзать, втыкать, жалить, шить",指に棘を刺してしまった,Unit05
449,殺す,ころす,убивать,ゴキブリをスリッパで叩いて、殺した,Unit05
450,隠れる,かくれる,"прятаться, скрываться<br><br>",逃げた犯人は空き家に隠れていた,Unit05
451,隠す,かくす,"прятать, скрывать",お金を引き出しの奥に隠した,Unit05
452,埋まる,うまる,"быть закрытым, быть заполненным",山が崩れて家が埋まってしまった,Unit05
453,埋める,うめる,"закапывать, хоронить, заполнять<br><br>",穴を掘って、ごみを埋めた,Unit05
454,囲む,かこむ,"окружать, осаждать",テーブルを囲んで、座る,Unit05
455,詰まる,つまる,"быть полным, набитым, стать короче",かばんにたくさん荷物が詰まっていて、重い,Unit05
456,詰める,つめる,"набивать, наполнять, сокращать",かばんに荷物を詰める,Unit05
457,開く,ひらく,"открывать, раскрывать, учреждать",ドアが開く,Unit05
458,閉じる,とじる,"закрывать, запирать",エレベーターのドアが閉じた,Unit05
459,飛ぶ,とぶ,"летать, нестись, прыгать",鳥が空を飛んでいる,Unit05
460,飛ばす,とばす,"пускать (по воздуху), бросать вверх, выпускать",紙飛行機を飛ばす,Unit05
461,振る,ふる,"махать, трясти, бросать, отвергать",手を振る,Unit05
462,めくる,めくる,"перелистывать, снимать, сдирать",カードを捲る,Unit05
463,見かける,みかける,"видеть, замечать",街で偶然、昔の友達を見かけた,Unit05
464,確かめる,たしかめる,"удостоверяться, уточнять",ファックスが届いたかどうか、相手に電話して確かめた,Unit05
465,試す,ためす,"испытывать, проверять",洋服が似合うかどうか、着て試してみた,Unit05
466,繰り返す,くりかえす,"повторять, делать снова",同じ失敗を繰り返してはいけません,Unit05
467,訳す,やくす,переводить,英語を日本語に訳す,Unit05
468,行う,おこなう,проводить (мероприятия),試験を行う,Unit05
469,間違う,まちがう,ошибаться,この計算は間違っている,Unit05
470,間違える,まちがえる,ошибаться,テストの答えを間違えた,Unit05
471,許す,ゆるす,"разрешать, позволять, прощать. Извинять",酷いことを言われて、喧嘩になったが、相手が謝ったので許してあげた,Unit05
472,慣れる,なれる,"привыкать, приучать, свыкаться",日本へ来て半年経って、生活にも慣れた,Unit05
473,慣らす,ならす,приучать,準備運動をして、体を慣らしてから、プールに入ったほうがいい,Unit05
474,立つ,たつ,"стоять, вставать, быть воздвигнутым",名前を呼ばれたら、立ってください,Unit05
475,立てる,たてる,"ставить, строить, воздвигать",屋根の上にアンテナを立てる,Unit05
476,建つ,たつ,"быть воздвигнутым, выситься, быть основанным",家の前に大きなマンションが建った,Unit05
477,建てる,たてる,"строить, воздвигать, основывать",都心に家を建てるのは大変だ,Unit05
478,育つ,そだつ,"расти, воспитываться",雨が多い年は、米が良く育つ,Unit05
479,育てる,そだてる,"воспитывать, растить",母は五人の子供を育てた,Unit05
480,生える,はえる,"расти (о растениях, зубах, ногтях, волосах)",髪が生える,Unit05
481,生やす,はやす,"отпускать, носить (бороду, усы)",髭を生やす,Unit05
482,汚れる,よごれる,пачкаться,空気の汚れた所には住みたくない,Unit05
483,汚す,よごす,пачкать,泥遊びをして、服を汚した,Unit05
484,壊れる,こわれる,"ломаться, разбиваться, разрушаться",家が壊れる,Unit05
485,壊す,こわす,"разрушать, ломать, разбивать (на части)",家を壊す,Unit05
486,割れる,われる,"ломаться, разбиваться, трескаться, разделяться",ガラスが割れる,Unit05
487,割る,わる,"делить, разделять, ломать, раскалывать",ガラスを割る,Unit05
488,折れる,おれる,"ломаться, складываться",強い風で枝が折れた,Unit05
489,折る,おる,"ломать, сгибать",スキーをして、足の骨を折った,Unit05
490,破れる,やぶれる,"разбиваться, рваться, ломаться",紙が破れる,Unit05
491,破る,やぶる,"разбивать, ломать, рвать",紙を破る,Unit05
492,曲がる,まがる,гнуться,曲がった道,Unit05
493,曲げる,まげる,"гнуть, сгибать, искривлять",針金を曲げる,Unit05
494,外れる,はずれる,"соскакиввать, соскальзывать, не попадать, не удаваться",ボタンが外れる,Unit05
495,外す,はずす,"отцеплять, разъединять, снимать, упускать",メガネを外す,Unit05
496,揺れる,ゆれる,"качаться, колебаться, дрожать",風で木の葉が揺れている,Unit05
497,揺らす,ゆらす,"трясти, качать, колебать",子供の乗ったブランコを揺らして遊ばせた,Unit05
498,流れる,ながれる,"течь, плыть (по течению)",町の中心を大きな川が流れている,Unit05
499,流す,ながす,пускать (по течению),汚れた水を川に流してはいけない,Unit05
500,濡れる,ぬれる,промокать,雨に濡れて風邪を引いた,Unit05
501,濡らす,ぬらす,мочить,水を零して、服を濡らしてしまった,Unit05
502,迷う,まよう,"сомневаться, заблуждаться",道に迷う,Unit05
503,悩む,なやむ,"страдать, мучиться",就職するか、進学するか、悩んでいる,Unit05
504,慌てる,あわてる,"волноваться, нервничать, суетиться",学校に遅れそうになって、慌てて家を出た,Unit05
505,覚める,さめる,"просыпаться, протрезвляться",昨夜は暑くて、夜中に何度も目が覚めた,Unit05
506,覚ます,さます,"просыпаться, отрезвлять",目を覚ますと、もう十時だった,Unit05
507,眠る,ねむる,"засыпать, спать",入試の前の日、緊張して良く眠れなかった,Unit05
508,祈る,いのる,молиться,家族の健康を神に祈った,Unit05
509,祝う,いわう,праздновать,新年を祝って、乾杯した,Unit05
510,感じる,かんじる,чувствовать,寒さを感じる,Unit05
511,クラスメート,クラスメート,одноклассник,,Unit06
512,グループ,グループ,группа,,Unit06
513,チーム,チーム,команда,,Unit06
514,プロフェッショナル／プロ,プロフェッショナル／プロ,профессионал,,Unit06
515,アマチュア,アマチュア,（アマ）,,Unit06
516,トレーニング,トレーニング,обучение,,Unit06
517,マッサージ,マッサージ,массаж,,Unit06
518,アドバイス,アドバイス,совет,,Unit06
519,アイデア／アイディア,アイデア／アイディア,идея,,Unit06
520,トップ,トップ,"рейтинг, топ",,Unit06
521,スピード,スピード,скорость,,Unit06
522,ラッシュ,ラッシュ,"суматоха, суета",,Unit06
523,バイク,バイク,мотоцикл,,Unit06
524,ヘルメット,ヘルメット,"шлем, каска",,Unit06
525,コンタクトレンズ／コンタクト,コンタクトレンズ／コンタクト,контактные линзы,,Unit06
526,ガラス,ガラス,стекло,,Unit06
527,プラスチック,プラスチック,"пластик, пластмасса",,Unit06
528,ベランダ,ベランダ,балкон,,Unit06
529,ペット,ペット,"питомец, домашнее животное",,Unit06
530,ベンチ,ベンチ,"скамейка, лавка",,Unit06
531,デザイン,デザイン,дизайн,,Unit06
532,バーゲンセール,バーゲンセール,дешевая распродажа,,Unit06
533,パート,パート,"часть, партия",,Unit06
534,コンビニエンスストア／コンビニ,コンビニエンスストア／コンビニ,небольшой магазин,,Unit06
535,レジ,レジ,"касса, кассир",,Unit06
536,レシート,レシート,квитанция,,Unit06
537,インスタント,インスタント,"быстрый, быстрого приготовления",,Unit06
538,ファストフード,ファストフード,фастфуд,,Unit06
539,フルーツ,フルーツ,фрукты,,Unit06
540,デザート,デザート,десерт,,Unit06
541,インターネット,インターネット,интернет,,Unit06
542,チャイム,チャイム,"перезвон, колокола, дверной звонок",,Unit06
543,アナウンス,アナウンス,диктор,,Unit06
544,メッセージ,メッセージ,сообщение,,Unit06
545,パンフレット,パンフレット,"буклет, брошюра, проспект",,Unit06
546,カード,カード,карточка,,Unit06
547,インタビュー,インタビュー,интервью,,Unit06
548,アンケート,アンケート,"анкета, опрос",,Unit06
549,データ,データ,"данные, информация",,Unit06
550,パーセント,パーセント,процент,,Unit06
551,濃い,こい,"густой, крепкий",色が濃い,Unit07
552,薄い,うすい,"тонкий, слабый, жидкий",薄い本,Unit07
553,酸っぱい,すっぱい,кислый,レモンは酸っぱい,Unit07
554,臭い,くさい,"зловонный, вонючий",納豆は臭いから、嫌いだという日本人も多い,Unit07
555,おかしい,おかしい,"смешной, странный, чудной",山本君は授業中にいつもおかしいことを言って、皆を笑わせる,Unit07
556,かっこいい,かっこいい,клевый,あの先輩はかっこいいので、人気がある,Unit07
557,うまい,うまい,умелый,母は料理がうまい,Unit07
558,親しい,したしい,"дружеский, близкий, задушевный",私は田中さんと親しい,Unit07
559,詳しい,くわしい,подробный,この地図はとても詳しい,Unit07
560,細かい,こまかい,"мелкий, тонкий, тщательный, скупой",新聞の字は細かくて、お年寄りには読みづらい,Unit07
561,浅い,あさい,"мелкий, поверхностный",この川は浅いので、子供が泳いでも危なくない,Unit07
562,固い／硬い,かたい,"твердый, крепкий, тугой",このパンはとても固い,Unit07
563,ぬるい,ぬるい,"остывший, холодный, снисходительный",温いコーヒーは美味しくない,Unit07
564,まぶしい,まぶしい,"ослепительный, очень яркий",カーテンを開けたら、太陽が眩しかった,Unit07
565,蒸し暑い,むしあつい,"душный, знойный",日本の夏は蒸し暑い,Unit07
566,清潔な,せいけつな,чистый,清潔な服を身につける,Unit07
567,新鮮な,しんせんな,"свежий, новый",新鮮な魚は美味しい,Unit07
568,豊かな,ゆたかな,"обильный, богатый",豊かな資源,Unit07
569,立派な,りっぱな,великолепный,立派な人,Unit07
570,正確な,せいかくな,"правильный, верный, точный, аккуратный",正確な数は分からないが、この観客は五千人ぐらいだろう,Unit07
571,確かな,たしかな,"достоверный, надежный, прочный",新聞は確かな事実だけを伝えなければならない,Unit07
572,重要な,じゅうような,"важный, серьезный",今日は午後から重要な会議がある,Unit07
573,必要な,ひつような,необходимый,子供に必要なのは、親の温かい愛情だ,Unit07
574,もったいない,もったいない,"расточительно, не бережно, не дело, не годится",流行遅れでも、まだ着られる服を捨てるのは勿体ない,Unit07
575,すごい,すごい,"крутой, круто",昨日の台風はすごかった,Unit07
576,ひどい,ひどい,"жестокий, ужасный, несправедливый",一人を大勢で苛めるとは酷い,Unit07
577,激しい,はげしい,"сильный, яростный",雨が激しい,Unit07
578,そっくりな,そっくりな,"нетронутый, как есть",兄は父に顔も声もそっくりだ,Unit07
579,急な,きゅうな,"срочный, внезапный",急に歯が痛みだした,Unit07
580,適当な,てきとうな,"подходящий, соответствующий",家庭教師を探しているが、適当な人が中々いない,Unit07
581,特別な,とくべつな,"особый, специальный, исключительный",彼女には音楽家としての特別な才能がある,Unit07
582,完全な,かんぜんな,"совершенный, полный, целый, целиком",土の中から古代の器が完全な形で出てきた,Unit07
583,盛んな,さかんな,"процветающий, успешный, сильный, энергичный",私の故郷は農業が盛んだ,Unit07
584,様々な,さまざまな,"всяческие, всевозможные",インタネットから様々な情報が得られる,Unit07
585,可能な,かのうな,возможный,科学が進歩して、今まで不可能だったことも可能になった,Unit07
586,不可能な,ふかのうな,невозможный,不可能な計画なら、始めから立てないほうがいい,Unit07
587,基本的な,きほんてきな,"основной, стандартный",パソコンの基本的な使い方はマニュアルに書いてある,Unit07
588,国際的な,こくさいてきな,"международный, мировой",東京で国際的なアニメフェスティバルが開かれた,Unit07
589,ばらばらな,ばらばらな,разрозненный,皆の意見がばらばらで、中々結論が出ない,Unit07
590,ぼろぼろな,ぼろぼろな,"оборванный, изодранный, ветхий",ぼろぼろな服,Unit07
591,非常に,ひじょうに,"чрезвычайно, необыкновенно, очень",これは非常に高価な物ですので、気をつけて運んでください,Unit08
592,大変（に）,たいへん（に）,ужасно,朝夕は電車が大変込むので、疲れる,Unit08
593,ほとんど,ほとんど,"почти, чуть не, почти все",準備は殆どできた,Unit08
594,大体,だいたい,"в общем, в целом, в основном, по сути",今日の試験は大体できた,Unit08
595,かなり,かなり,"довольно, изрядно, прилично",頭痛の薬を飲んだら、三十分ぐらいで可也良くなった,Unit08
596,ずいぶん,ずいぶん,"порядком, весьма и весьма",暫く会わない間に、チンさんは随分日本語が上手になっていた,Unit08
597,けっこう,けっこう,"прекрасный, превосходный, великолепный",日曜日なので、込んでいるかと思ったら、結構空いていた,Unit08
598,大分,だいぶ／だいぶん,"изрядно, немало, весьма",病気は大分良くなった,Unit08
599,もっと,もっと,"больше, более",リンゴよりイチゴのほうが好きだ、でもメロンはもっと好きだ,Unit08
600,しっかり,しっかり,"крепко, надежно",桜の花はもうすっかり散ってしまった,Unit08
601,一杯,いっぱい,полный,会場には子供たちが一杯いて、とても賑やかだった,Unit08
602,ぎりぎり,ぎりぎり,"на пределе, только-только, в обрез, с натягом",走れば、九時の電車にぎりぎり間に合うだろう,Unit08
603,ぴったり（と）,ぴったり（と）,"плотно, точно, идеально, как раз",七時ぴったりに目覚まし時計をセットした,Unit08
604,たいてい,たいてい,обычно,日曜日は大抵家にいます,Unit08
605,同時に,どうじに,"одновременно, синхронно",二人は同時にゴールした,Unit08
606,前もって,まえもって,заранее,もし欠席する場合は、前もってご連絡します,Unit08
607,すぐ（に）,すぐ（に）,"сразу же, сейчас же, скоро",チャイムを鳴らすと、すぐにドアが開いた,Unit08
608,もうすぐ,もうすぐ,"вскоре, скоро",日本へ来て、もうすぐ三年になる,Unit08
609,突然,とつぜん,"неожиданно, внезапно, вдруг",子供が突然飛び出してきたので、急ブレーキを掛けた,Unit08
610,あっという間（に）,あっというま（に）,в мгновение ока,子供の成長は早い、あっという間に、もう小学生だ,Unit08
611,いつの間にか,いつのまにか,"незаметно, мгновенно, не успеешь оглянуться",いつの間にか、外は暗くなっていた,Unit08
612,しばらく,しばらく,"некоторое время, немного",ただ今窓口が込んでいますので、もう暫くお待ちください,Unit08
613,ずっと,ずっと,"все время, гораздо (более), далеко",バスよりも地下鉄で行くほうがずっと速い,Unit08
614,相変わらず,あいかわらず,без изменений,あの女優は年を取った今も相変わらずきれいだ,Unit08
615,次々に／と,つぎつぎに／と,"друг за другом, один за другим",新しいタイプのインスタント食品が次々に発売されている,Unit08
616,どんどん,どんどん,"стучать. барабанить, быстро, скоро, много",今日は体調も良く、仕事がどんどん進んだ,Unit08
617,ますます,ますます,все более и более,朝から降っていた雨は、午後になると益々強くなった,Unit08
618,やっと,やっと,"наконец-то, еле-еле, кое-как, с трудом",三十分も待って、やっとバスが来た,Unit08
619,とうとう,とうとう,"в конце концов, наконец",長い間使っていた洗濯機が到頭壊れてしまった,Unit08
620,ついに,ついに,"наконец, в конце концов",若い頃の夢を遂に実現することができた,Unit08
621,もちろん,もちろん,конечно,マンションを買った、勿論、ローンでだ,Unit08
622,やはり,やはり,"все-таки, все равно, также, тоже",矢張りAチームが勝った、予想通りだった,Unit08
623,きっと,きっと,"непременно, обязательно, наверняка",田中さんはいつも遅刻するから、今日もきっと遅れてくるだろう,Unit08
624,ぜひ,ぜひ,"непременно, обязательно",若いときに、是非留学したいと思っている,Unit08
625,なるべく,なるべく,"по возможности, насколько возможно",成るべく辞書を見ないで、この本を読んでみてください,Unit08
626,案外,あんがい,"неожиданно, вопреки предположениям",今日は曇っているが、案外暖かい,Unit08
627,もしかすると／もしかしたら／もしかして,もしかすると／もしかしたら／もしかして,"вдруг, возможно",体調が悪いので、もしかすると、明日休むかもしれません,Unit08
628,まさか,まさか,не может быть,あの二人、離婚するそうだよ、真逆あんなに仲が良くかったのに,Unit08
629,うっかり,うっかり,"рассеянно, невнимательно",うっかりして、砂糖と塩を間違えて入れてしまった,Unit08
630,つい,つい,"невольно, нечаянно",禁煙しようと思うのだが、食事の後などについ吸ってしまう,Unit08
631,思わず,おもわず,"невольно, невзначай",夜道で急に肩を叩かれ、思わずワーッと叫んでしまった,Unit08
632,ほっと,ほっと,глубоко (вздохнуть) облегченно,試験が終わってほっとした,Unit08
633,いらいら,いらいら,"раздраженно, нервно",急いでいるのに、バスが中々来なくて、いらいらした,Unit08
634,のんびり,のんびり,"беззаботно, расслабленно, лениво, неторопливо",半年ほどとても忙しかった、温泉へでも行ってのんびりしたい,Unit08
635,実は,じつは,по правде,昨日言ったことは、実は嘘なんです,Unit08
636,読書,どくしょ,чтение,趣味は読書だ,Unit09
637,演奏,えんそう,музыкальное исполнение,楽器を演奏する,Unit09
638,芸術,げいじゅつ,искусство,美術、音楽、文学、演劇などは、みな、芸術の一種であると言える,Unit09
639,検査,けんさ,"проверка, осмотр",胃の検査,Unit09
640,血液,けつえき,кровь,体の中を血液が流れている,Unit09
641,治療,ちりょう,лечение,病気を治療した,Unit09
642,症状,しょうじょう,"симптомы, состояние (больного)",風邪の症状は熱、咳、鼻水などだ,Unit09
643,予防,よぼう,"предупреждение, предотвращение, профилактика",風邪の予防,Unit09
644,栄養,えいよう,"питание, питательность",栄養の、ある食べ物,Unit09
645,手術,しゅじゅつ,хирургическая операция,胃の手術をした,Unit09
646,死亡,しぼう,"смерть, кончина",死亡の原因を調べる,Unit09
647,命,いのち,жизнь,命は大切にしなければならない,Unit09
648,一生,いっしょう,вся жизнь,ピカソの一生を調べる,Unit09
649,誤解,ごかい,"заблуждение, ошибка, недоразумение",誤解がないようにするには、良く話し合うことが大切だ,Unit09
650,後悔,こうかい,"раскаяние, сожаление",私は若い頃に勉強しなかったことを、とても後悔している,Unit09
651,訳,わけ,"смысл, значение, суть, причина",遅刻した訳を話す,Unit09
652,態度,たいど,"отношение, позиция, поведение",あの学生は授業中の態度が悪い,Unit09
653,癖,くせ,"привычка, манера, манерность",私の癖は困ったとき、頭を掻くことだ,Unit09
654,礼儀,れいぎ,"манеры, приличия, этикет",目上の人への礼儀,Unit09
655,文句,もんく,"слова, выражение, фраза, жалобы",給料に文句がある,Unit09
656,表情,ひょうじょう,выражение (лица),顔の表情,Unit09
657,表面,ひょうめん,"лицевая сторона. поверхность, наружность",水の表面,Unit09
658,禁煙,きんえん,запрет курения,この部屋は禁煙です,Unit09
659,禁止,きんし,"запрещение, запрет",美術館の中では、写真を撮ることは禁止されている,Unit09
660,完成,かんせい,"завершение, окончание",建物が完成した,Unit09
661,課題,かだい,"тема, проблема, задача, вопрос, урок",現在の日本には、高齢か、ごみ問題など、多くの課題がある,Unit09
662,例外,れいがい,исключение (из правил),どんな規則にも例外がある,Unit09
663,基本,きほん,"основа, база, фундамент, стандарт",何の練習でも、基本が大切だ,Unit09
664,記録,きろく,"запись, реестр, протокол",先週の会議の記録を読んだ,Unit09
665,状態,じょうたい,"состояние, положение, условия",あの会社は、今経営の状態が良くない,Unit09
666,出来事,できごと,"происшествие, событие, инцидент",大きな出来事,Unit09
667,場面,ばめん,"сцена, место действия, состояние биржи",目の前でトラックとバスが衝突した、その場面が夢に出てきた,Unit09
668,機会,きかい,"благоприятный случай, удобный момент",彼女と二人で話したいのだが、中々機会がない,Unit09
669,距離,きょり,"расстояние, дистанция, интервал",駅からの距離を測る,Unit09
670,提案,ていあん,"предложение, проект",会議で提案をする,Unit09
671,やり取り,やりとり,обмен,友達とメールをやり取りする,Unit09
